college_name,department_name,first_step_one_subject,first_step_one_point,first_step_one_ratio,first_step_two_subject,first_step_two_point,first_step_two_ratio,first_step_three_subject,first_step_three_point,first_step_three_ratio,first_step_four_subject,first_step_four_point,first_step_four_ratio,first_step_five_subject,first_step_five_point,first_step_five_ratio,second_step_one_ratio,second_step_two_ratio,second_step_three_ratio,second_step_four_ratio,second_step_five_ratio,second_step_all_ratio,second_step_one_subject,second_step_one_point,second_step_one_all_ratio,second_step_two_subject,second_step_two_point,second_step_two_all_ratio,second_step_three_subject,second_step_three_point, second_step_three_all_ratio,second_step_four_subject,second_step_four_point,second_step_four_all_ratio,second_step_five_subject,second_step_five_point,second_step_five_all_ratio,final_order,thing,order_select,found
國立聯合大學,環境與安全衛生工程學系,國文,--,--,英文,--,--,數學A,後標,3,自然,--,3,,,,*1.00,*1.00,*2.00,*2.00,,50%,審查資料,60分,50%,團體訪談與認識本系,60分,10%,,,,,,,,,,一、學科能力測驗成績二、審查資料三、學測英文級分四、學測自然級分,項目：修課紀錄(A)、課程學習成果(B、D)、多元表現(F、K、M、N)、學習歷程自述(O、P、Q)、其他(R.非修課之各類實作作品) ,一、學測國文、英文、數學A、自然之級分總和,1
國立臺灣大學,生物環境系統工程學系,國文,前標,--,英文,前標,10,數學A,頂標,3,自然,頂標,6,,,,*1.00,*1.00,*1.00,*1.00,,30%,審查資料,--,30%,口試,--,40%,,,,,,,,,,一、學測國文級分二、學測英文級分三、學測數學A級分四、學測自然級分,項目：修課紀錄(A)、課程學習成果(B、D)、多元表現(F、L、M、N)、學習歷程自述(O、P、Q) ,一、學測國文、英文、數學A、自然之級分總和　二、學測國文級分　三、學測英文級分　四、學測自然級分,1
國立臺北教育大學,社會與區域發展學系,國文,均標,--,英文,均標,--,數學B,均標,--,社會,均標,3,國英,--,5,*1.00,*1.00,*1.00,*1.00,--,50%,審查資料,--,50%,面試,--,20%,,,,,,,,,,一、學測英文級分二、學測社會級分三、學測數學B級分四、學測國文級分,項目：修課紀錄(A)、課程學習成果(B、C、E)、多元表現(F、G、I、M、N)、學習歷程自述(O、Q)、其他(R.個人資料表、S.有利本系參考資料) ,一、學測國文、英文、數學B、社會之級分總和　二、學測英文級分　三、學測社會級分　四、學測數學B級分,1
國立臺北教育大學,社會與區域發展學系(青年儲蓄帳戶組),國文,均標,--,英文,均標,--,社會,均標,--,,,,,,,--,--,--,,,0%,審查資料,--,0%,面試,--,30%,,,,,,,,,,一、審查資料二、面試,項目：修課紀錄(A)、其他(R.體驗資歷（體驗學習報告及雙週誌）) ,(無),0
國立成功大學,系統及船舶機電工程學系,國文,均標,--,英文,前標,--,數學A,前標,5,自然,前標,5,國英自,--,3,*1.00,*1.00,*1.00,*1.00,--,50%,審查資料,--,50%,面試,--,15%,,,,,,,,,,一、面試二、審查資料三、學測國英數A自級分總和四、學測數學A級分,項目：修課紀錄(A)、課程學習成果(B、C、D)、多元表現(F、G、J、M、N)、學習歷程自述(O、P、Q) ,一、學測國文、英文、數學A、自然之級分總和　二、學測數學A級分　三、學測自然級分　四、學測英文級分,1
國立臺灣海洋大學,系統工程暨造船學系,英文,均標,6.0,數學A,均標,4.0,自然,均標,3.0,,,,,,,*1.25,*1.50,*1.25,,,50%,審查資料,--,50%,,,,,,,,,,,,,一、學科能力測驗成績二、學測英數A自級分總和三、學測數學A級分四、學測自然級分,項目：修課紀錄(A)、課程學習成果(B、D)、多元表現(F、J、L、N)、學習歷程自述(O、P、Q)、其他(R.其他有利審查資料) ,一、學測英文、數學A、自然之級分總和　二、學測數學A級分　三、學測英文級分,1
長榮大學,綠能與環境資源學系綠能環境科技組,國文,--,3.0,自然,底標,10.0,,,,,,,,,,*1.00,*1.00,,,,10%,審查資料,--,10%,面試,--,50%,,,,,,,,,,一、學測國文級分二、審查資料三、學測自然級分四、學測國自級分總和,項目：修課紀錄(A)、課程學習成果(B、C、D)、多元表現(F、G、I、M、N)、學習歷程自述(O、P、Q)、其他(R.其他有利於審查之資料) ,一、學測國文、自然之級分總和　二、學測自然級分,0
長榮大學,綠能與環境資源學系綠能產業實務組,國文,--,12,英文,底標,--,社會,--,10,,,,,,,*1.00,*1.00,*1.00,,,10%,審查資料,--,10%,面試,--,50%,,,,,,,,,,一、學測國文級分二、審查資料三、學測社會級分四、學測國英社級分總和,項目：修課紀錄(A)、課程學習成果(B、C、D)、多元表現(F、G、I、M、N)、學習歷程自述(O、P、Q)、其他(R.其他有利於審查之資料) ,一、學測國文、英文、社會之級分總和　二、學測國文級分,0
長榮大學,綠能與環境資源學系綠能產業管理組,國文,底標,7,英文,--,--,社會,--,12,,,,,,,*1.00,*1.00,*1.00,,,10%,審查資料,--,10%,面試,--,50%,,,,,,,,,,一、學測國文級分二、審查資料三、學測社會級分四、學測國英社級分總和,項目：修課紀錄(A)、課程學習成果(B、C、E)、多元表現(F、G、I、M、N)、學習歷程自述(O、P、Q)、其他(R.其他有利於審查之資料) ,一、學測國文、英文、社會之級分總和　二、學測社會級分,0
國立臺南大學,綠色能源科技學系,國文,--,7.0,英文,--,5.0,數學A,均標,3.0,,,,,,,*1.00,*1.00,*1.00,,,50%,審查資料,--,50%,,,,,,,,,,,,,一、學測數學A級分二、學測英文級分三、學測國文級分四、審查資料,項目：修課紀錄(A)、課程學習成果(B)、多元表現(F、G、H、I、N)、學習歷程自述(O、P、Q) ,一、學測國文、英文、數學A之級分總和　二、學測數學A級分　三、學測英文級分　四、學測國文級分,1
國立成功大學,能源國際學士學位學程,國文,--,--,英文,前標,10,數學A,前標,5,自然,前標,5,國英數A自,--,3,*1.00,*1.00,*1.00,*1.00,--,50%,審查資料,--,50%,,,,,,,,,,,,,一、學科能力測驗成績二、學測數學A級分三、學測自然級分四、學測英文級分,項目：修課紀錄(A)、課程學習成果(B、C、D)、多元表現(F、J、L、M、N)、學習歷程自述(P) ,一、學測國文、英文、數學A、自然之級分總和　二、學測數學A級分　三、學測自然級分　四、學測英文級分,0
國立聯合大學,能源工程學系,英文,--,5,數學A,--,--,自然,後標,3,,,,,,,--,*1.00,*1.00,,,45%,審查資料,--,45%,面試,--,15%,,,,,,,,,,一、學科能力測驗成績二、學測數學A級分三、學測英文級分四、學測自然級分,項目：修課紀錄(A)、多元表現(F、M、N)、學習歷程自述(P、Q)、其他(R.其他有利審查資料) ,一、學測英文、數學A、自然之級分總和,1
國立東華大學,臺灣文化學系,國文,--,--,英文,--,--,社會,均標,3,,,,,,,*1.00,*2.00,*2.00,,,30%,審查資料,--,30%,面試,--,40%,,,,,,,,,,一、面試二、審查資料三、學測英文級分四、學測社會級分,項目：修課紀錄(A)、課程學習成果(B、C)、多元表現(F、J、L、M、N)、學習歷程自述(O、P、Q) ,一、學測國文、英文、社會之級分總和　二、學測英文級分　三、學測社會級分,1
國立成功大學,資源工程學系,國文,均標,10.0,英文,均標,8.0,數學A,均標,4.0,自然,均標,6.0,國英數A自,--,3.0,*1.00,*1.00,*1.00,*1.00,--,50%,審查資料,--,50%,,,,,,,,,,,,,一、學科能力測驗成績二、審查資料三、學測數學A級分,項目：修課紀錄(A)、課程學習成果(B、C、D)、多元表現(F、G、J、M、N)、學習歷程自述(P、Q) ,一、學測國文、英文、數學A、自然之級分總和　二、學測數學A級分　三、學測自然級分,1
