college_name,department_name,first_step_one_subject,first_step_one_point,first_step_one_ratio,first_step_two_subject,first_step_two_point,first_step_two_ratio,first_step_three_subject,first_step_three_point,first_step_three_ratio,first_step_four_subject,first_step_four_point,first_step_four_ratio,first_step_five_subject,first_step_five_point,first_step_five_ratio,second_step_one_ratio,second_step_two_ratio,second_step_three_ratio,second_step_four_ratio,second_step_five_ratio,second_step_all_ratio,second_step_one_subject,second_step_one_point,second_step_one_all_ratio,second_step_two_subject,second_step_two_point,second_step_two_all_ratio,second_step_three_subject,second_step_three_point, second_step_three_all_ratio,second_step_four_subject,second_step_four_point,second_step_four_all_ratio,second_step_five_subject,second_step_five_point,second_step_five_all_ratio,final_order,thing,order_select,found
高雄醫學大學,運動醫學系,國文,--,--,英文,均標,8,數學A,--,--,自然,均標,3,,,,*1.00,*1.00,*1.25,*1.25,,30%,審查資料,--,30%,面試,--,40%,,,,,,,,,,一、面試二、學測自然級分三、學測數學A級分四、學測英文級分,項目：修課紀錄(A)、課程學習成果(B、C)、多元表現(F、G、J、M、N)、學習歷程自述(O、P、Q) ,一、學測國文、英文、數學A、自然之級分總和　二、學測自然級分　三、學測數學A級分　四、學測英文級分,1
中國醫藥大學,運動醫學系,國文,--,--,英文,後標,10,自然,後標,3,,,,,,,*1.00,*1.00,*1.00,,,20%,審查資料,--,20%,面談,--,45%,,,,,,,,,,一、面談二、學測自然級分三、學測英文級分四、學測國文級分,項目：修課紀錄(A)、多元表現(F、N)、學習歷程自述(O、P、Q) ,一、學測國文、英文、自然之級分總和　二、學測自然級分　三、學測英文級分　四、學測國文級分,1
中國文化大學,運動與健康促進學系,國文,--,--,英文,--,5,,,,,,,,,,*1.00,*2.00,,,,40%,審查資料,--,40%,面試(含體適能測驗),--,30%,,,,,,,,,,--,項目：修課紀錄(A)、課程學習成果(B)、多元表現(F、G、L、M、N)、學習歷程自述(O、P、Q) ,一、學測國文、英文之級分總和　二、學測英文級分,1
臺北市立大學,運動健康科學系,國文,--,--,英文,--,--,自然,--,--,國英自,--,12,,,,*1.00,*1.50,*1.00,--,,40%,審查資料,--,40%,面試,--,25%,,,,,,,,,,體育(百分等級),項目：修課紀錄(A)、課程學習成果(B、D)、多元表現(F、J、L、M、N)、學習歷程自述(P) ,一、學測國文、英文、自然之級分總和　二、學測英文級分　三、學測自然級分　四、學測國文級分,1
國立體育大學,運動保健學系,國文,--,--,英文,後標,--,數學A,--,--,自然,--,--,國英數A自,--,3,*1.00,*1.25,*1.00,*1.00,--,30%,審查資料,--,30%,面試,--,30%,,,,,,,,,,一、面試二、審查資料三、學科能力測驗成績四、學測英文級分,項目：修課紀錄(A)、課程學習成果(B、C、D)、多元表現(F、I、J、M、N)、學習歷程自述(P)、其他(R.自傳(按本系格式)) ,一、學測國文、英文、數學A、自然之級分總和　二、學測英文級分　三、學測自然級分　四、學測國文級分,1
大葉大學,運動健康管理學系,國文,--,9.0,,,,,,,,,,,,,--,,,,,0%,審查資料,--,0%,面試,--,80%,,,,,,,,,,--,項目：修課紀錄(A)、課程學習成果(B)、多元表現(F、G、I、M、N)、學習歷程自述(P、Q)、其他(R.可附有利於審查之資料) ,一、學測國文級分,1
國立臺灣體育運動大學,運動健康科學學系,國文,後標,3,英文,後標,3,數學A,後標,--,數學B,後標,--,自然,後標,3,*1.00,*2.00,--,--,*1.50,30%,審查資料,--,30%,面試,--,35%,,,,,,,,,,一、面試二、審查資料三、學測自然級分四、學測英文級分,項目：修課紀錄(A)、課程學習成果(B)、多元表現(F、G、L、M、N)、學習歷程自述(P、Q) ,一、學測國文、英文、自然之級分總和　二、學測自然級分　三、學測英文級分,1
