college_name,department_name,first_step_one_subject,first_step_one_point,first_step_one_ratio,first_step_two_subject,first_step_two_point,first_step_two_ratio,first_step_three_subject,first_step_three_point,first_step_three_ratio,first_step_four_subject,first_step_four_point,first_step_four_ratio,first_step_five_subject,first_step_five_point,first_step_five_ratio,second_step_one_ratio,second_step_two_ratio,second_step_three_ratio,second_step_four_ratio,second_step_five_ratio,second_step_all_ratio,second_step_one_subject,second_step_one_point,second_step_one_all_ratio,second_step_two_subject,second_step_two_point,second_step_two_all_ratio,second_step_three_subject,second_step_three_point, second_step_three_all_ratio,second_step_four_subject,second_step_four_point,second_step_four_all_ratio,second_step_five_subject,second_step_five_point,second_step_five_all_ratio,final_order,thing,order_select,found
東海大學,餐旅管理學系,國文,--,3.0,英文,後標,3.0,,,,,,,,,,*1.50,*2.00,,,,50%,審查資料,--,50%,面試,--,20%,,,,,,,,,,一、學測英文級分二、學測國文級分三、學測國英級分總和,項目：修課紀錄(A)、課程學習成果(B)、多元表現(F、G、H、N)、學習歷程自述(O、P、Q) ,一、學測國文、英文之級分總和　二、學測英文級分　三、學測國文級分,1
輔仁大學,餐旅管理學系,國文,--,--,英文,均標,--,數學B,--,--,國英數B,--,3,,,,*1.50,*1.50,*1.00,--,,50%,審查資料,--,50%,,,,,,,,,,,,,一、學測英文級分二、學測國文級分三、學測數學B級分四、指定項目甄試成績,項目：修課紀錄(A)、課程學習成果(B、C、E)、多元表現(F、G、H、K、N)、學習歷程自述(O、P、Q) ,一、學測國文、英文、數學B之級分總和,1
大葉大學,餐旅管理學系,國文,底標,20.0,社會,--,10.0,國社,--,3.0,,,,,,,--,--,--,,,0%,審查資料,--,0%,面試,--,55%,,,,,,,,,,一、面試二、審查資料三、學測國文級分四、學測社會級分,項目：修課紀錄(A)、課程學習成果(B、C)、多元表現(F、J、L、M、N)、學習歷程自述(O、P、Q) ,一、學測國文、社會之級分總和　二、學測國文級分　三、學測社會級分,1
大葉大學,烘焙暨飲料調製學士學位學程,國文,底標,15.0,社會,--,10.0,國社,--,3.0,,,,,,,--,--,--,,,0%,審查資料,--,0%,面試,--,55%,,,,,,,,,,一、面試二、審查資料三、學測國文級分四、學測社會級分,項目：修課紀錄(A)、課程學習成果(B、C)、多元表現(F、J、L、M、N)、學習歷程自述(O、P、Q) ,一、學測國文、社會之級分總和　二、學測國文級分　三、學測社會級分,1
中華大學,餐旅管理學系,國文,底標,3.0,,,,,,,,,,,,,--,,,,,0%,審查資料,--,0%,面試,--,55%,,,,,,,,,,一、面試二、審查資料,項目：修課紀錄(A)、多元表現(F、G、M、N) ,一、學測國文級分,1
中華大學,國際觀光與酒店管理雙學士學位學程,英文,底標,25,英聽,C級,--,,,,,,,,,,--,--,,,,0%,審查資料,--,0%,面試,--,55%,,,,,,,,,,一、面試二、審查資料,項目：修課紀錄(A)、多元表現(L、N)、學習歷程自述(O、P、Q) ,一、學測英文級分,1
義守大學,餐旅管理學系,國文,後標,3,英文,--,5,社會,--,--,,,,,,,*2.00,*1.00,*1.75,,,30%,審查資料,--,30%,面試,--,40%,,,,,,,,,,一、面試二、審查資料三、學測國文級分四、學測社會級分,項目：修課紀錄(A)、課程學習成果(B、C)、多元表現(F、N)、學習歷程自述(O、P) ,一、學測國文、英文、社會之級分總和　二、學測國文級分　三、學測社會級分　四、學測英文級分,1
義守大學,廚藝學系,國文,--,--,英文,後標,3,社會,--,--,,,,,,,*1.00,*2.00,*1.50,,,20%,審查資料,--,20%,面試,--,45%,,,,,,,,,,一、面試二、審查資料三、學測英文級分四、學測社會級分,項目：修課紀錄(A)、課程學習成果(B、C)、多元表現(F、N)、學習歷程自述(O、P) ,一、學測國文、英文、社會之級分總和　二、學測英文級分　三、學測社會級分　四、學測國文級分,1
實踐大學,智慧服務管理英語學士學位學程(臺北校區),國文,--,--,英文,底標,3,,,,,,,,,,*1.00,*2.00,,,,20%,審查資料,--,20%,英文面試,--,30%,,,,,,,,,,一、英文面試二、學測英文級分三、審查資料,項目：修課紀錄(A)、課程學習成果(B)、多元表現(G、H、M、N)、學習歷程自述(O、P、Q)、其他(R.有利於審查之相關資料) ,一、學測國文、英文之級分總和　二、學測國文級分,1
國立暨南國際大學,觀光休閒與餐旅管理學系餐旅管理組,國文,均標,6.5,英文,--,5.0,,,,,,,,,,*2.00,*2.00,,,,40%,審查資料,--,40%,面試,--,30%,,,,,,,,,,一、面試二、學測國文級分三、學測英文級分,項目：修課紀錄(A)、課程學習成果(B、C、E)、多元表現(F、G、H、I、N)、學習歷程自述(O、P、Q) ,一、學測國文、英文之級分總和,1
玄奘大學,餐旅管理學系,國文,底標,4.5,,,,,,,,,,,,,*1.00,,,,,10%,審查資料,--,10%,面試,--,50%,,,,,,,,,,一、面試二、審查資料三、學測國文級分,項目：修課紀錄(A)、課程學習成果(B、C)、多元表現(G、I、N)、學習歷程自述(P、Q) ,一、學測國文級分,1
開南大學,觀光與餐飲旅館學系,國文,底標,3.0,,,,,,,,,,,,,--,,,,,0%,審查資料,--,0%,面試,--,50%,,,,,,,,,,一、面試二、審查資料,項目：修課紀錄(A)、課程學習成果(B)、多元表現(F、G、M、N)、學習歷程自述(P、Q) ,一、學測國文級分,1
台灣首府大學,餐旅管理學系,國文,底標,3,社會,底標,--,,,,,,,,,,*2.00,*2.00,,,,30%,審查資料,--,30%,,,,,,,,,,,,,一、學測國文級分二、學測社會級分,項目：修課紀錄(A)、課程學習成果(B)、多元表現(F、N) ,一、學測國文、社會之級分總和　二、學測國文級分　三、學測社會級分,1
台灣首府大學,烘焙管理學系,國文,底標,3,社會,底標,--,,,,,,,,,,*2.00,*2.00,,,,30%,審查資料,--,30%,,,,,,,,,,,,,一、學測國文級分二、學測社會級分,項目：修課紀錄(A)、課程學習成果(B)、多元表現(F、N) ,一、學測國文、社會之級分總和　二、學測國文級分　三、學測社會級分,1
佛光大學,健康與創意蔬食產業學系,國文,底標,8.0,,,,,,,,,,,,,*1.00,,,,,10%,審查資料,--,10%,面試,--,50%,,,,,,,,,,一、面試二、學測國文級分,項目：修課紀錄(A)、課程學習成果(B)、多元表現(F、N)、學習歷程自述(P) ,一、學測國文級分,1
明道大學,餐旅管理學系,國文,--,--,英文,--,3,數學B,底標,--,,,,,,,*1.00,*2.00,*1.00,,,10%,審查資料,--,10%,面試,--,50%,,,,,,,,,,一、面試二、審查資料,項目：修課紀錄(A)、課程學習成果(B)、多元表現(F、G、H、I、N)、學習歷程自述(Q) ,一、學測國文、英文、數學B之級分總和,1
